{
  "$schema": "./fidelity-policy.schema.json",
  "version": "1.0.0",
  "principle": "runtime-obligation-first",
  "fidelityLevels": [
    "isolated",
    "simulated",
    "contract",
    "real-dependency",
    "full-system"
  ],
  "defaultMinimumFidelity": "simulated",
  "surfacePolicies": [],
  "inventorySourcePolicies": [],
  "behaviorPolicies": []
}
